{
  "$schema": "http://json-schema.org/draft-07/schema#",
  "title": "v12 real provider input shape",
  "type": "object",
  "required": [
    "fixture",
    "teams",
    "standings_context",
    "team_stats_season",
    "team_stats_recent",
    "league_market_profile",
    "odds_snapshot",
    "timing_profile",
    "scoreline_profile",
    "risk_flags"
  ],
  "properties": {
    "fixture": {
      "type": "object"
    },
    "teams": {
      "type": "object"
    },
    "standings_context": {
      "type": "object"
    },
    "team_stats_season": {
      "type": "object"
    },
    "team_stats_recent": {
      "type": "object"
    },
    "league_market_profile": {
      "type": "object"
    },
    "odds_snapshot": {
      "type": "object"
    },
    "timing_profile": {
      "type": "object"
    },
    "scoreline_profile": {
      "type": "object"
    },
    "risk_flags": {
      "type": "object"
    }
  }
}